{
  "formatVersion": "0.1",
  "entity": {
    "name": "A & B <Group>"
  },
  "scope": {
    "label": "Scope \"quoted\""
  },
  "units": [
    {
      "id": "shares",
      "label": "Shares & units",
      "measure": "shares",
      "scale": 0
    },
    {
      "id": "usd",
      "label": "USD <millions>",
      "measure": "USD",
      "scale": 6
    }
  ],
  "periods": [
    {
      "id": "at-2024",
      "kind": "instant",
      "date": "2024-12-31"
    },
    {
      "id": "at-2025",
      "kind": "instant",
      "date": "2025-12-31"
    }
  ],
  "groupingColumns": [
    "valuation",
    "ppt"
  ],
  "statements": [
    {
      "id": "ordered",
      "label": "Ordered & escaped",
      "periods": [
        "at-2025",
        "at-2024"
      ],
      "items": [
        {
          "id": "cash",
          "label": "Cash <available>",
          "unit": "usd",
          "values": {
            "at-2025": "0",
            "at-2024": null
          },
          "groupings": {
            "valuation": "NWC & cash",
            "ppt": null
          }
        },
        {
          "id": "inventory",
          "label": "Inventory",
          "unit": "usd",
          "values": {
            "at-2025": "-1.25",
            "at-2024": {
              "unavailable": true
            }
          },
          "groupings": {
            "valuation": "NWC",
            "ppt": "Working <Capital>"
          }
        }
      ]
    },
    {
      "id": "mixed-units",
      "label": "Mixed units",
      "periods": [
        "at-2025"
      ],
      "items": [
        {
          "id": "amount",
          "label": "Amount",
          "unit": "usd",
          "values": {
            "at-2025": "2.5"
          },
          "groupings": {
            "valuation": null,
            "ppt": "Summary"
          }
        },
        {
          "id": "count",
          "label": "Count",
          "unit": "shares",
          "values": {
            "at-2025": "3"
          },
          "groupings": {
            "valuation": null,
            "ppt": "Summary"
          }
        }
      ]
    }
  ]
}
