{
  "formatVersion": "0.1",
  "entity": {
    "name": "Example Entity"
  },
  "scope": {
    "label": "Consolidated financial statements"
  },
  "units": [
    {
      "id": "usd",
      "label": "USD",
      "measure": "USD",
      "scale": 0
    }
  ],
  "periods": [
    {
      "id": "fy2025",
      "kind": "duration",
      "start": "2025-01-01",
      "end": "2025-12-31"
    }
  ],
  "statements": [
    {
      "id": "statement",
      "label": "Statement",
      "periods": [
        "fy2025"
      ],
      "items": [
        {
          "id": "child",
          "label": "Child",
          "unit": "usd",
          "values": {
            "fy2025": "10"
          },
          "groupings": {},
          "rollupTo": "total"
        },
        {
          "id": "total",
          "label": "Total",
          "unit": "usd",
          "values": {
            "fy2025": "11"
          },
          "groupings": {}
        }
      ]
    }
  ],
  "validationSnapshot": {
    "conformance": "conforming",
    "calculations": "consistent",
    "applications": [
      {
        "key": {
          "statement": "statement",
          "parent": "total",
          "period": "fy2025"
        },
        "status": "satisfied",
        "actual": "10",
        "expected": "10",
        "difference": "0",
        "tolerance": "0"
      }
    ]
  }
}
